{"$schema":"https://json-schema.org/draft/2020-12/schema","$id":"incremental-planner-physical-application-audit.schema.json","type":"object","additionalProperties":false,"required":["schema_version","historical_reused","historical_reused_records","new_planned_slides","new_physical_slides","new_physical_plan_ids","historical_migrations","historical_relayout_without_dependency_change_count","historical_visual_migration_count","semantic_insertion_status","body_reference_priority","shell_override_count"],"properties":{"schema_version":{"const":"2.0.0"},"historical_reused":{"type":"integer","minimum":0},"historical_reused_records":{"type":"array","items":{"$ref":"#/$defs/reused"}},"new_planned_slides":{"type":"integer","minimum":0},"new_physical_slides":{"type":"integer","minimum":0},"new_physical_plan_ids":{"type":"array","items":{"type":"string","pattern":"^PCP-"}},"historical_migrations":{"const":0},"historical_relayout_without_dependency_change_count":{"const":0},"historical_visual_migration_count":{"const":0},"semantic_insertion_status":{"enum":["pass","fail"]},"body_reference_priority":{"type":"array","minItems":1,"items":{"type":"string","pattern":"^JDP-TSMC-"}},"shell_override_count":{"const":0}},"$defs":{"reused":{"type":"object","additionalProperties":false,"required":["slide_id","previous_accepted_artifact_hash","current_reused_artifact_hash","dependency_equal"],"properties":{"slide_id":{"type":"string","minLength":1},"previous_accepted_artifact_hash":{"type":"string","pattern":"^[a-f0-9]{64}$"},"current_reused_artifact_hash":{"type":"string","pattern":"^[a-f0-9]{64}$"},"dependency_equal":{"const":true}}}}}
